{
  "frame_id": "frame-77b148350ba4",
  "mission_id": "bundle_p14_p17",
  "phase_id": "P17",
  "system_refs": [
    ".aiwg/evolution/current_position.json",
    ".aiwg/evolution/next_phase_seed.json",
    ".aiwg/world_model/project_world_model.json",
    ".aiwg/schemas/truth_hierarchy.schema.json",
    ".aiwg/schemas/cognitive_artifact.schema.json"
  ],
  "mission_refs": [
    ".aiwg/reports/context_package_latest.json",
    ".aiwg/reports/context_receipt_latest.json",
    ".aiwg/reports/context_quant_result_latest.json"
  ],
  "context_refs": [
    "state:current_position",
    "state:next_phase_seed",
    "wm:project_world_model",
    "coverage:spec_coverage_matrix",
    "note:l4_edge",
    "note:l6_skin",
    "note:evolution",
    "note:world_model",
    "note:l0_overseer",
    "note:l1_nervous",
    "note:l3_shield",
    "note:l5_muscle",
    "note:architecture"
  ],
  "compressed_refs": [
    "note:specs",
    "note:l2_brain"
  ],
  "dropped_refs": [],
  "retrieval_refs": [],
  "token_budget": 1800,
  "estimated_tokens": 153,
  "staleness_warnings": [
    "folder_note_hash_mismatch",
    "stale_freshness"
  ],
  "truth_policy_refs": [
    ".aiwg/schemas/truth_hierarchy.schema.json",
    ".aiwg/schemas/cognitive_artifact.schema.json",
    ".aiwg/evolution/current_position.json"
  ],
  "prompt_sections": {
    "system": [
      "Use canonical state files and truth hierarchy before any derived artifact.",
      "Do not consume raw folder dumps; use references and compressed summaries.",
      "Reject secrets and private reasoning artifacts in context."
    ],
    "mission": [
      "Mission: bundle_p14_p17",
      "Phase: P17",
      "Budget: 1800",
      "Receipt decision: WARN"
    ],
    "context": [
      "[state:current_position] (fresh) Current phase is P17 and next required phase is P18.",
      "[state:next_phase_seed] (fresh) Next phase seed: P18 - CLI Control Plane.",
      "[wm:project_world_model] (fresh) World model version 1.0.0 with next phase unknown.",
      "[coverage:spec_coverage_matrix] (fresh) Spec coverage: total 100, complete triplets 97.",
      "[note:l4_edge] (fresh) Folder l4_edge status=active, specs=2, tests=0.",
      "[note:l6_skin] (fresh) Folder l6_skin status=active, specs=2, tests=1.",
      "[note:evolution] (fresh) Folder evolution status=active, specs=3, tests=1.",
      "[note:world_model] (fresh) Folder world_model status=active, specs=1, tests=0.",
      "[note:l0_overseer] (fresh) Folder l0_overseer status=active, specs=2, tests=6.",
      "[note:l1_nervous] (fresh) Folder l1_nervous status=active, specs=2, tests=6.",
      "[note:l3_shield] (fresh) Folder l3_shield status=active, specs=2, tests=3.",
      "[note:l5_muscle] (fresh) Folder l5_muscle status=active, specs=2, tests=1.",
      "[note:architecture] (fresh) Folder architecture status=active, specs=1, tests=0."
    ],
    "warnings": [
      "folder_note_hash_mismatch",
      "stale_freshness"
    ]
  },
  "receipt_ref": ".aiwg/reports/context_receipt_latest.json",
  "source_hash": "d77861df77e940307eb1a38dc46adfebf5b843e3ebacb10beca4e7991ac866fc",
  "created_at": "2026-05-16T13:30:28Z"
}
